{
  "configVersion": 1,
  "endpoints": [
    {
      "id": "default",
      "displayName": "我的模型",
      "baseURL": "https://api.deepseek.com",
      "defaultModel": "deepseek-flash",
      "visionModel": "",
      "apiKeyModelId": null,
      "supportsJsonMode": true,
      "supportsVision": true,
      "enableThinking": false,
      "preserveThinking": false,
      "timeoutMs": 300000
    }
  ],
  "stageModels": {
    "read_problem": "default",
    "solve": "default",
    "breakdown": "default",
    "analysis": "default",
    "scene_code": "default",
    "dry_run": "default",
    "repair": "default",
    "couple": "default",
    "knowledgecard": "default"
  },
  "keys": {}
}
